{"schema_version":"1.0.0","policy_id":"urn:gew:profile-coverage-policy:v1","approved_profile_registry_digest":"sha256-jcs-v1:694655c82293cbf25b41dca7a1c87e3d37989eb11058375ed1c778786b268fdc","evidence_authority":{"registry_digest":"sha256-jcs-v1:282715dcc04d9acff448b5445eaa096ba1b8ee85faab928362c72384747a17a8","oracle_manifest_sha256":"6dbdcda71719ce28fb3ba59ff777c125537c1adae576ad6193c86dac8e77fb97"},"profile_column_ids":["normal","boundary","revise","authority","drift","invalidation","recovery","artifacts","review","target","rollback","real-e2e"],"risk_path_ids":["full-planned","compact-planned","emergency"],"risk_path_policy":{"overlays":[{"overlay_id":"full-planned","overlay_version":"1.0.0","approved_body_digest":"sha256-jcs-v1:6180cba3cb7ba47ae80a6273bf850fd2b4ae84adeef84e654d7072aea50029b4"},{"overlay_id":"compact-planned","overlay_version":"1.0.0","approved_body_digest":"sha256-jcs-v1:ada5c730e28b6dcd6f03005e4bcec332d7566a76a06ed3d80d280d0c4d042894"},{"overlay_id":"emergency","overlay_version":"1.0.0","approved_body_digest":"sha256-jcs-v1:b0e7cddae0c5da66fcc5ac69aa71aa902951baf5da9ac9c2fe9b5a45b0999010"}]},"case_binding_policy":{"evidence_type":"coverage-record","owner_gate":"WP-08","profiles":[{"profile_id":"new-feature","profile_version":"1.0.0","fixture_id":"profile:new-feature:1.0.0","oracle_id":"ORA-PROFILE-NEW-FEATURE"},{"profile_id":"bug-fix","profile_version":"1.0.0","fixture_id":"profile:bug-fix:1.0.0","oracle_id":"ORA-PROFILE-BUG-FIX"},{"profile_id":"hotfix","profile_version":"1.0.0","fixture_id":"profile:hotfix:1.0.0","oracle_id":"ORA-PROFILE-HOTFIX"},{"profile_id":"refactor-debt","profile_version":"1.0.0","fixture_id":"profile:refactor-debt:1.0.0","oracle_id":"ORA-PROFILE-REFACTOR-DEBT"},{"profile_id":"migration","profile_version":"1.0.0","fixture_id":"profile:migration:1.0.0","oracle_id":"ORA-PROFILE-MIGRATION"},{"profile_id":"dependency-security","profile_version":"1.0.0","fixture_id":"profile:dependency-security:1.0.0","oracle_id":"ORA-PROFILE-DEPENDENCY-SECURITY"},{"profile_id":"performance","profile_version":"1.0.0","fixture_id":"profile:performance:1.0.0","oracle_id":"ORA-PROFILE-PERFORMANCE"},{"profile_id":"release-operations","profile_version":"1.0.0","fixture_id":"profile:release-operations:1.0.0","oracle_id":"ORA-PROFILE-RELEASE-OPERATIONS"},{"profile_id":"incident-response","profile_version":"1.0.0","fixture_id":"profile:incident-response:1.0.0","oracle_id":"ORA-PROFILE-INCIDENT-RESPONSE"}]},"runtime_pins":{"runtime_kind":"platform-neutral","runtime_lineage_id":"core-profile-materializer-v1","runtime_digest":"sha256-jcs-v1:bbbbbbbbbbbbbbbbbbbbbbbbbbbbbbbbbbbbbbbbbbbbbbbbbbbbbbbbbbbbbbbb"},"execution_policy":{"default_execution_kind":"contract-test","real_e2e_column_id":"real-e2e","real_e2e_execution_kind":"real-target"},"scenarios":[{"profile_id":"new-feature","scenario_ids":["scaffold","existing-feature","multi-target"]},{"profile_id":"bug-fix","scenario_ids":["reproducible-failure","false-reproduction","regression-boundary"]},{"profile_id":"hotfix","scenario_ids":["emergency-baseline","minimal-patch","production-like-gate"]},{"profile_id":"refactor-debt","scenario_ids":["behavior-characterization","architecture-invariant","nonfunctional-target"]},{"profile_id":"migration","scenario_ids":["forward","backward","partial-data","crash-window"]},{"profile_id":"dependency-security","scenario_ids":["vulnerable-graph","transitive-dependency","fix-unavailable"]},{"profile_id":"performance","scenario_ids":["stable-baseline","noise-outlier","correctness-regression"]},{"profile_id":"release-operations","scenario_ids":["artifact-provenance","health-gate","partial-deploy"]},{"profile_id":"incident-response","scenario_ids":["detection","containment","recovery","unknown-effects"]}],"required_invariant_ids":["authority","completion","digest","finite-budget","independent-review","invalidation","replay-protection","schema"],"policy_digest":"sha256-jcs-v1:946c6f6875ef74e944be328de0ecb0a936f44ef937bd5d556ae5450610f8f488"}
